{
  "app": "0.1.0",
  "builtIn": false,
  "kind": "preset",
  "label": "Confidence",
  "layouts": {
    "*": {
      "boxes": [
        {
          "binding": { "kind": "field", "name": "body" },
          "fallback": false,
          "fit": { "maxLines": 8, "minSize": 20, "policy": "maxLines" },
          "frame": { "h": 0.75, "w": 0.94, "x": 0.03, "y": 0.05 },
          "grade": null,
          "textStyle": {
            "alignment": "left",
            "allCaps": false,
            "color": { "a": 1, "b": 1, "g": 1, "r": 1 },
            "font": "HelveticaNeue-Bold",
            "fromStyle": 1,
            "letterSpacing": 0,
            "lineSpacing": 1.1,
            "outline": {
              "color": { "a": 1, "b": 0, "g": 0, "r": 0 },
              "width": 0
            },
            "shadow": {
              "blur": 0,
              "color": { "a": 0, "b": 0, "g": 0, "r": 0 },
              "x": 0,
              "y": 0
            },
            "size": { "unit": "pt", "value": 64 },
            "variations": {},
            "weight": 700
          },
          "transition": { "ms": null, "ref": 1 },
          "transitionOnVariableChange": false
        },
        {
          "binding": { "kind": "static", "text": "[Time]" },
          "fallback": false,
          "fit": { "maxLines": 1, "minSize": 12, "policy": "shrinkToFit" },
          "frame": { "h": 0.1, "w": 0.27, "x": 0.7, "y": 0.86 },
          "grade": null,
          "textStyle": {
            "alignment": "right",
            "allCaps": true,
            "color": { "a": 1, "b": 1, "g": 1, "r": 1 },
            "font": "HelveticaNeue-Medium",
            "fromStyle": 2,
            "letterSpacing": 0.5,
            "lineSpacing": 1.2,
            "outline": {
              "color": { "a": 1, "b": 0, "g": 0, "r": 0 },
              "width": 1
            },
            "shadow": {
              "blur": 0,
              "color": { "a": 0, "b": 0, "g": 0, "r": 0 },
              "x": 0,
              "y": 0
            },
            "size": { "unit": "percent", "value": 4.5 },
            "variations": { "wdth": 110, "wght": 500 },
            "weight": 500
          },
          "transition": { "ms": 120, "ref": 2 },
          "transitionOnVariableChange": true
        }
      ],
      "mask": null
    }
  },
  "number": 2,
  "schema": 1,
  "uuid": "c0de0000-0000-4000-8000-000000000002"
}
